{"$id":"https://single-image-studio.invalid/research/slice-09/schemas/gateb-decision.slice09.v0.schema.json","$schema":"https://json-schema.org/draft/2020-12/schema","additionalProperties":false,"properties":{"calibrationAuthorized":{"const":false},"contentHash":{"pattern":"^[a-f0-9]{64}$","type":"string"},"decisionId":{"pattern":"^[A-Za-z0-9][A-Za-z0-9._:@-]{0,199}$","type":"string"},"evidenceBoundary":{"additionalProperties":false,"properties":{"C1":{"const":0},"E1":{"const":0},"G1":{"const":0},"O1":{"const":0},"R1":{"const":0},"U1":{"const":0},"V1":{"const":0},"formal":{"const":false},"productSupport":{"const":false},"releaseAllowlist":{"const":"none"},"releaseApproved":{"const":0},"releaseRegistered":{"const":0}},"required":["C1","U1","E1","R1","O1","G1","V1","productSupport","formal","releaseAllowlist","releaseRegistered","releaseApproved"],"type":"object"},"gateBPassed":{"type":"boolean"},"operation":{"enum":["normalize","export"]},"schemaVersion":{"const":"gateb-decision.slice09.v0"},"state":{"enum":["pass","denied-closed-non-pass"]},"summaryRef":{"pattern":"^[A-Za-z0-9][A-Za-z0-9._:@-]{0,199}$","type":"string"}},"required":["schemaVersion","decisionId","operation","state","summaryRef","gateBPassed","calibrationAuthorized","evidenceBoundary","contentHash"],"type":"object"}
