{"calibrationAuthorized":false,"contentHash":"572c76a5e194b2ce3dc8800088a5da8bed60efb6697f6306bad3b9d029a840e6","decisionId":"decision.s09.export","evidenceBoundary":{"C1":0,"E1":0,"G1":0,"O1":0,"R1":0,"U1":0,"V1":0,"formal":false,"productSupport":false,"releaseAllowlist":"none","releaseApproved":0,"releaseRegistered":0},"gateBPassed":true,"operation":"export","schemaVersion":"gateb-decision.slice09.v0","state":"pass","summaryRef":"summary.s09.export"}
